{
  "schema_version": "1.0.0",
  "descriptor_id": "bmp388",
  "descriptor_version": "1.0.0",
  "driver_id": "bmp388",
  "protocol": "i2c",
  "description": "Initial reviewed device profile; defaults are example policy, not universal runtime rules.",
  "instance_schema": {
    "type": "object",
    "additionalProperties": false,
    "properties": {
      "device_id": {
        "type": "string",
        "pattern": "^[A-Za-z][A-Za-z0-9_.-]{0,30}$"
      },
      "driver": {
        "const": "bmp388"
      },
      "descriptor": {
        "type": "object",
        "additionalProperties": false,
        "properties": {
          "id": {
            "const": "bmp388"
          },
          "version": {
            "const": "1.0.0"
          }
        },
        "required": [
          "id",
          "version"
        ]
      },
      "enabled": {
        "type": "boolean"
      },
      "interface": {
        "type": "object",
        "additionalProperties": false,
        "properties": {
          "ref": {
            "type": "string",
            "pattern": "^[A-Za-z][A-Za-z0-9_.-]{0,30}$"
          },
          "address": {
            "enum": [
              "0x76",
              "0x77"
            ]
          }
        },
        "required": [
          "ref",
          "address"
        ]
      },
      "behaviour": {
        "type": "object",
        "additionalProperties": false,
        "properties": {
          "profile": {
            "const": "periodic_sensor"
          },
          "operation": {
            "const": "read"
          },
          "interval_ms": {
            "type": "integer",
            "minimum": 200,
            "maximum": 60000
          },
          "timeout_ms": {
            "type": "integer",
            "minimum": 10,
            "maximum": 100
          },
          "destination": {
            "type": "string",
            "pattern": "^[A-Za-z][A-Za-z0-9_.-]{0,30}$"
          }
        },
        "required": [
          "profile",
          "operation",
          "interval_ms",
          "timeout_ms",
          "destination"
        ]
      },
      "task": {
        "type": "object",
        "additionalProperties": false,
        "properties": {
          "name": {
            "type": "string",
            "pattern": "^[A-Za-z][A-Za-z0-9_.-]{0,30}$"
          },
          "priority": {
            "type": "integer",
            "minimum": 1,
            "maximum": 31
          },
          "stack_size_bytes": {
            "type": "integer",
            "minimum": 1024,
            "maximum": 8192
          }
        },
        "required": [
          "name",
          "priority",
          "stack_size_bytes"
        ]
      }
    },
    "required": [
      "device_id",
      "driver",
      "descriptor",
      "enabled",
      "interface",
      "behaviour",
      "task"
    ]
  },
  "bus_schema": {
    "type": "object",
    "properties": {
      "protocol": {
        "const": "i2c"
      },
      "clock_hz": {
        "type": "integer",
        "minimum": 10000,
        "maximum": 400000
      }
    }
  },
  "execution": {
    "kind": "periodic",
    "period_field": "interval_ms",
    "timeout_field": "timeout_ms",
    "timeout_unit": "ms"
  },
  "routing": {
    "output_type": "environment_sample",
    "input_types": []
  },
  "resources": {
    "min_stack_bytes": 3072,
    "max_instances": 2
  },
  "defaults": {
    "behaviour": {
      "profile": "periodic_sensor",
      "operation": "read",
      "interval_ms": 2000,
      "timeout_ms": 20,
      "destination": "telemetry.environment"
    },
    "priority": 12,
    "stack_size_bytes": 3072
  },
  "provenance": [
    "https://github.com/waiyan0x/INF2004-uT-Home/blob/56f718e/firmware/drivers/bmp388/bmp388.c",
    "https://www.bosch-sensortec.com/media/boschsensortec/downloads/datasheets/bst-bmp388-ds001.pdf"
  ]
}
