{
  "schema_version": "1.0.0",
  "descriptor_id": "hc_sr04",
  "descriptor_version": "1.0.0",
  "driver_id": "hc_sr04",
  "protocol": "gpio",
  "description": "Initial reviewed device profile; defaults are example policy, not universal runtime rules.",
  "instance_schema": {
    "type": "object",
    "additionalProperties": false,
    "properties": {
      "device_id": {
        "type": "string",
        "pattern": "^[A-Za-z][A-Za-z0-9_.-]{0,30}$"
      },
      "driver": {
        "const": "hc_sr04"
      },
      "descriptor": {
        "type": "object",
        "additionalProperties": false,
        "properties": {
          "id": {
            "const": "hc_sr04"
          },
          "version": {
            "const": "1.0.0"
          }
        },
        "required": [
          "id",
          "version"
        ]
      },
      "enabled": {
        "type": "boolean"
      },
      "interface": {
        "type": "object",
        "additionalProperties": false,
        "properties": {
          "protocol": {
            "const": "gpio"
          },
          "trigger_gpio": {
            "type": "integer",
            "minimum": 0,
            "maximum": 63
          },
          "echo_gpio": {
            "type": "integer",
            "minimum": 0,
            "maximum": 63
          },
          "echo_voltage_divider_required": {
            "const": true
          }
        },
        "required": [
          "protocol",
          "trigger_gpio",
          "echo_gpio",
          "echo_voltage_divider_required"
        ]
      },
      "behaviour": {
        "type": "object",
        "additionalProperties": false,
        "properties": {
          "profile": {
            "const": "periodic_sensor"
          },
          "operation": {
            "const": "measure_distance"
          },
          "interval_ms": {
            "type": "integer",
            "minimum": 100,
            "maximum": 2000
          },
          "timeout_us": {
            "type": "integer",
            "minimum": 25000,
            "maximum": 30000
          },
          "destination": {
            "type": "string",
            "pattern": "^[A-Za-z][A-Za-z0-9_.-]{0,30}$"
          }
        },
        "required": [
          "profile",
          "operation",
          "interval_ms",
          "timeout_us",
          "destination"
        ]
      },
      "task": {
        "type": "object",
        "additionalProperties": false,
        "properties": {
          "name": {
            "type": "string",
            "pattern": "^[A-Za-z][A-Za-z0-9_.-]{0,30}$"
          },
          "priority": {
            "type": "integer",
            "minimum": 1,
            "maximum": 31
          },
          "stack_size_bytes": {
            "type": "integer",
            "minimum": 1024,
            "maximum": 8192
          }
        },
        "required": [
          "name",
          "priority",
          "stack_size_bytes"
        ]
      }
    },
    "required": [
      "device_id",
      "driver",
      "descriptor",
      "enabled",
      "interface",
      "behaviour",
      "task"
    ]
  },
  "bus_schema": {
    "type": "object"
  },
  "execution": {
    "kind": "periodic",
    "period_field": "interval_ms",
    "timeout_field": "timeout_us",
    "timeout_unit": "us"
  },
  "routing": {
    "output_type": "distance_sample",
    "input_types": []
  },
  "resources": {
    "min_stack_bytes": 3072,
    "max_instances": 4
  },
  "defaults": {
    "behaviour": {
      "profile": "periodic_sensor",
      "operation": "measure_distance",
      "interval_ms": 1000,
      "timeout_us": 30000,
      "destination": "distance.front"
    },
    "priority": 10,
    "stack_size_bytes": 3072
  },
  "provenance": [
    "https://github.com/waiyan0x/INF2004-uT-Home/blob/974eb9c/firmware/drivers/hc_sr04/hc_sr04.c"
  ]
}
